{
  "schema_version": 1,
  "manifest_id": "claude-code-conformance-2026-08-15-candidate",
  "adapter_id": "claude-code",
  "support_release_id": "claude-code-support-2026-08-15-candidate",
  "checks": [
    { "check_id": "schema-validation", "requirement": "All ADS/support documents pass strict schemas and cross-reference checks.", "status": "pass", "command": "python3 scripts/agent_support/validate.py", "report_sha256": null, "claim_refs": ["claude-source-map"] },
    { "check_id": "sanitizer", "requirement": "All committed fixtures pass deterministic sanitizer and prohibited-field checks.", "status": "pass", "command": "python3 -m unittest scripts.agent_support.test_contracts", "report_sha256": null, "claim_refs": ["claude-privacy-policy"] },
    { "check_id": "family-disposition", "requirement": "Every declared non-empty native family owns exactly one top-level disposition.", "status": "pass", "command": "python3 scripts/agent_support/validate.py", "report_sha256": null, "claim_refs": ["claude-source-map"] },
    { "check_id": "source-bounds", "requirement": "Every selector and source primitive has finite auditable object/record bounds.", "status": "pass", "command": "python3 scripts/agent_support/validate.py", "report_sha256": null, "claim_refs": ["claude-source-map"] },
    { "check_id": "scope-access", "requirement": "Every RFC 012D relation stays within declared roots and measured access budgets.", "status": "planned", "command": null, "report_sha256": null, "claim_refs": ["claude-scope-relations-open"] },
    { "check_id": "version-classifier", "requirement": "Exact, range, recognized-unverified, and incompatible artifacts select only promoted releases.", "status": "pass", "command": "python3 -m unittest scripts.agent_support.test_contracts", "report_sha256": null, "claim_refs": ["claude-artifact-target-open"] },
    { "check_id": "contract-negotiation", "requirement": "Incompatible public semantic versions fail before source access.", "status": "pass", "command": "python3 -m unittest scripts.agent_support.test_contracts", "report_sha256": null, "claim_refs": ["claude-source-map"] },
    { "check_id": "identity-determinism", "requirement": "Source, entity, record, fact, and revision identities survive replay and registration reorder.", "status": "planned", "command": null, "report_sha256": null, "claim_refs": ["claude-identity-rules"] },
    { "check_id": "tier-compositionality", "requirement": "Head/prefix plus continuation equals full-only ordered records, facts, and final decoder state.", "status": "planned", "command": null, "report_sha256": null, "claim_refs": ["claude-source-map"] },
    { "check_id": "usage-v2-shadow-reducer", "requirement": "Response identity, exact repeats, evolving and downward snapshots, missing buckets, reused request IDs, actor attribution, and generation replacement reduce without duplicate contributions while legacy usage remains intact.", "status": "pass", "command": "cargo test -p spaghetti-napi engine::projection::tests::usage_v2_replaces_response_snapshots_without_changing_legacy_usage -- --exact", "report_sha256": null, "claim_refs": ["claude-runtime-semantics-open"] },
    { "check_id": "usage-v2-independent-oracle", "requirement": "The frozen sanitized fixture reduces under an adapter-free qualified-bucket oracle with a stable detailed-state digest.", "status": "pass", "command": "python3 scripts/usage_v2_oracle/test_oracle.py", "report_sha256": "sha256:555ba85bca79f18c500c243d618bd40bc1ce468e4a801951f89fa72ac0324e95", "claim_refs": ["claude-runtime-semantics-open"] },
    { "check_id": "usage-v2-oracle-parity", "requirement": "The real root and subagent decoders plus durable reducer match the independent oracle's qualified response, actor, session, fallback, and reset state.", "status": "pass", "command": "cargo test -p spaghetti-napi engine::projection::tests::usage_v2_projection_matches_independent_qualified_oracle -- --exact", "report_sha256": "sha256:555ba85bca79f18c500c243d618bd40bc1ce468e4a801951f89fa72ac0324e95", "claim_refs": ["claude-runtime-semantics-open"] },
    { "check_id": "actor-affiliation-reducer", "requirement": "Late workflow/team affiliations regroup existing actor usage while explicit removal, ambiguity, and generation replacement cannot duplicate or reburn canonical responses.", "status": "pass", "command": "cargo test -p spaghetti-napi engine::projection::tests::late_actor_affiliations_regroup_usage_without_copying_or_reburning_responses -- --exact", "report_sha256": null, "claim_refs": ["claude-runtime-semantics-open"] },
    { "check_id": "usage-v2-shadow-query", "requirement": "The versioned shadow query returns qualified response revisions and canonical actor context under one commit snapshot, pages without duplication, filters existing usage by actor or present affiliation, and expires a continuation after reset.", "status": "pass", "command": "cargo test -p spaghetti-napi engine::projection::tests:: -- --nocapture", "report_sha256": null, "claim_refs": ["claude-runtime-semantics-open"] },
    { "check_id": "usage-v2-pack-readiness", "requirement": "Only usage-provider streams publish Pending, the common post-drain barrier publishes query-visible Ready or Unavailable on the durable commit clock, unrelated stream commits do not churn readiness, and quarantine gaps cannot become ready without explicit replay.", "status": "pass", "command": "cargo test -p spaghetti-napi engine::coordinator::tests:: -- --nocapture", "report_sha256": null, "claim_refs": ["claude-runtime-semantics-open"] },
    { "check_id": "usage-v2-source-coverage", "requirement": "The readiness barrier atomically persists normalized support-bound RFC 012A fact-family coverage that survives restart, advances with its source cursor, remains stable on no-op scans, and represents a quarantine gap as requiring explicit replay.", "status": "pass", "command": "cargo test -p spaghetti-napi usage_v2_coverage -- --nocapture", "report_sha256": null, "claim_refs": ["claude-runtime-semantics-open"] },
    { "check_id": "usage-v2-public-coverage-query", "requirement": "The generic public fact-family coverage query pages normalized points, absences, and errors under one fixed snapshot, rejects stale continuations, and returns opaque common references without native paths or object keys.", "status": "pass", "command": "cargo test -p spaghetti-napi usage_v2_coverage -- --nocapture", "report_sha256": null, "claim_refs": ["claude-runtime-semantics-open"] },
    { "check_id": "usage-v2-explicit-replay", "requirement": "A source-instance-scoped common fact-family replay advances each present baseline object once, retracts old-generation usage, resumes bounded work after restart, and publishes replacement coverage without duplicate responses.", "status": "pass", "command": "cargo test -p spaghetti-napi engine::coordinator::tests::bounded_usage_v2_replay_resumes_after_restart_without_replaying_new_generation -- --exact", "report_sha256": null, "claim_refs": ["claude-runtime-semantics-open"] },
    { "check_id": "usage-v2-public-replay-authorization", "requirement": "Public fact-family replay requires current scope/source/digest/commit authorization, rejects stale tokens and wrong roots without a commit, atomically rolls back a writer-side compare-and-set mismatch, and expires the token after a successful replacement.", "status": "pass", "command": "cargo test -p spaghetti-napi engine::coordinator::tests::quarantined_usage_v2_coverage_stays_unavailable_until_explicit_replay -- --exact", "report_sha256": null, "claim_refs": ["claude-runtime-semantics-open"] },
    { "check_id": "classified-native-drift", "requirement": "Classified Claude bridge owner identifiers, active-session nameSince, and settings autoMode parse through agent-native shapes while remaining absent from common identity, FTS, logs, runtime presence, activity, ordering, effective-mode, and lifecycle semantics.", "status": "pass", "command": "cargo test -p spaghetti-napi classified_native_drift -- --nocapture", "report_sha256": null, "claim_refs": ["claude-drift-bridge-accounts", "claude-drift-active-name-since", "claude-drift-auto-mode"] },
    { "check_id": "unknown-retention", "requirement": "Unknown record families and fields remain bounded and measurable without native payload leakage.", "status": "planned", "command": null, "report_sha256": null, "claim_refs": ["claude-drift-bridge-accounts", "claude-drift-active-name-since"] },
    { "check_id": "cross-topology-parity", "requirement": "Durable and scoped decoding produce identical semantic revision references.", "status": "planned", "command": null, "report_sha256": null, "claim_refs": ["claude-runtime-semantics-open", "claude-scope-relations-open"] }
  ]
}
