{
  "schema_version": 1,
  "manifest_id": "grok-conformance-2026-08-15-candidate",
  "adapter_id": "grok",
  "support_release_id": "grok-support-2026-08-15-candidate",
  "checks": [
    { "check_id": "schema-validation", "requirement": "All ADS/support documents pass strict schemas and cross-reference checks.", "status": "pass", "command": "python3 scripts/agent_support/validate.py", "report_sha256": null, "claim_refs": ["grok-source-observed"] },
    { "check_id": "sanitizer", "requirement": "All committed fixtures pass deterministic sanitizer and prohibited-field checks.", "status": "pass", "command": "python3 -m unittest scripts.agent_support.test_contracts", "report_sha256": null, "claim_refs": ["grok-privacy-policy"] },
    { "check_id": "family-disposition", "requirement": "Every declared native family owns exactly one disposition.", "status": "pass", "command": "python3 scripts/agent_support/validate.py", "report_sha256": null, "claim_refs": ["grok-source-observed"] },
    { "check_id": "source-bounds", "requirement": "Every recursive selector and source primitive has finite object and record bounds.", "status": "pass", "command": "python3 scripts/agent_support/validate.py", "report_sha256": null, "claim_refs": ["grok-source-observed"] },
    { "check_id": "scope-access", "requirement": "Known history and sibling sidecars stay confined and inside declared budgets.", "status": "planned", "command": null, "report_sha256": null, "claim_refs": ["grok-scope-open"] },
    { "check_id": "version-classifier", "requirement": "Only promoted exact/range releases confer typed support.", "status": "pass", "command": "python3 -m unittest scripts.agent_support.test_contracts", "report_sha256": null, "claim_refs": ["grok-artifact-target-open"] },
    { "check_id": "contract-negotiation", "requirement": "Incompatible public semantic versions fail before source access.", "status": "pass", "command": "python3 -m unittest scripts.agent_support.test_contracts", "report_sha256": null, "claim_refs": ["grok-source-observed"] },
    { "check_id": "identity-determinism", "requirement": "Source/entity/record/fact identities survive replay and registration reorder.", "status": "planned", "command": null, "report_sha256": null, "claim_refs": ["grok-identity-open"] },
    { "check_id": "tier-compositionality", "requirement": "Prefix plus continuation equals full-only decode and final state.", "status": "planned", "command": null, "report_sha256": null, "claim_refs": ["grok-semantic-fixtures-open"] },
    { "check_id": "unknown-retention", "requirement": "Unknown sidecar records remain bounded and measurable while known UI updates are ignored once.", "status": "planned", "command": null, "report_sha256": null, "claim_refs": ["grok-semantic-fixtures-open"] },
    { "check_id": "cross-topology-parity", "requirement": "Durable and scoped decoding produce identical semantic revision references.", "status": "planned", "command": null, "report_sha256": null, "claim_refs": ["grok-scope-open"] }
  ]
}
