{
  "schema_version": 1,
  "manifest_id": "fixture-agent-conformance-2026-08-21-promoted",
  "adapter_id": "fixture-agent",
  "support_release_id": "fixture-agent-support-2026-08-21",
  "checks": [
    {
      "check_id": "schema-validation",
      "requirement": "All ADS/support documents pass strict schemas and cross-reference checks.",
      "status": "pass",
      "command": "python3 scripts/agent_support/validate.py",
      "report_sha256": null,
      "claim_refs": [
        "fixture-agent-source-observed"
      ]
    },
    {
      "check_id": "sanitizer",
      "requirement": "All committed fixtures pass deterministic sanitizer and prohibited-field checks.",
      "status": "pass",
      "command": "python3 scripts/agent_support/validate.py",
      "report_sha256": null,
      "claim_refs": [
        "fixture-agent-privacy-policy"
      ]
    },
    {
      "check_id": "family-disposition",
      "requirement": "Every declared native family owns exactly one disposition.",
      "status": "pass",
      "command": "python3 scripts/agent_support/validate.py",
      "report_sha256": null,
      "claim_refs": [
        "fixture-agent-source-observed"
      ]
    },
    {
      "check_id": "source-bounds",
      "requirement": "Every recursive selector and source primitive has finite object and record bounds.",
      "status": "pass",
      "command": "python3 scripts/agent_support/validate.py",
      "report_sha256": null,
      "claim_refs": [
        "fixture-agent-source-observed"
      ]
    },
    {
      "check_id": "scope-access",
      "requirement": "Known transcripts and optional session.json stay confined and inside declared budgets.",
      "status": "pass",
      "command": "python3 scripts/agent_support/validate.py",
      "report_sha256": null,
      "claim_refs": [
        "fixture-agent-source-observed"
      ]
    },
    {
      "check_id": "version-classifier",
      "requirement": "Only promoted exact/range releases confer typed support.",
      "status": "pass",
      "command": "python3 scripts/agent_support/validate.py",
      "report_sha256": null,
      "claim_refs": [
        "fixture-agent-source-observed"
      ]
    },
    {
      "check_id": "contract-negotiation",
      "requirement": "Incompatible public semantic versions fail before source access.",
      "status": "pass",
      "command": "python3 scripts/agent_support/validate.py",
      "report_sha256": null,
      "claim_refs": [
        "fixture-agent-source-observed"
      ]
    },
    {
      "check_id": "identity-determinism",
      "requirement": "Source/entity/record/fact identities survive replay and registration reorder.",
      "status": "pass",
      "command": "python3 scripts/agent_support/validate.py",
      "report_sha256": null,
      "claim_refs": [
        "fixture-agent-source-observed"
      ]
    },
    {
      "check_id": "tier-compositionality",
      "requirement": "Prefix plus continuation equals full-only decode and final state.",
      "status": "pass",
      "command": "python3 scripts/agent_support/validate.py",
      "report_sha256": null,
      "claim_refs": [
        "fixture-agent-source-observed"
      ]
    },
    {
      "check_id": "unknown-retention",
      "requirement": "Unknown transcript records remain bounded and measurable.",
      "status": "pass",
      "command": "python3 scripts/agent_support/validate.py",
      "report_sha256": null,
      "claim_refs": [
        "fixture-agent-source-observed"
      ]
    },
    {
      "check_id": "cross-topology-parity",
      "requirement": "Durable and scoped decoding produce identical semantic revision references.",
      "status": "pass",
      "command": "python3 scripts/agent_support/validate.py",
      "report_sha256": null,
      "claim_refs": [
        "fixture-agent-source-observed"
      ]
    }
  ]
}
